GUID	Date (GMT)	URL	Contents	Author	Name	Country	State/Region	City/Urban Area	Category	Emotion	Source	Gender	Posts	Followers	Following	Post Title	Post Type	Image URL	Brand
1095917868980436992	2019-02-14 05:29:15	http://twitter.com/haileykoolkid/status/1095917868980436992	b'rt @ucla happy #internationalcatday from the infamous campus cat, powell cat. :'	@haileykoolkid	hailey				Neutral	Neutral	Twitter	F	8801	418	337	"RT @UCLA Happy #InternationalCatDay from the infamous campus cat, Powell Cat. 

📷: https://t.co/hKj7uo32VV https://t.co/dujL3oteIF"	Retweet		
1096116949023567872	2019-02-14 18:40:20	http://twitter.com/UCLAVolunteer/status/1096116949023567872	"b""rt @ucla the number of people in need of an organ transplant continues to grow each year. this #organdonorday, learn how you can make a meaningful difference in someone's life."""	@UCLAVolunteer	UCLA Volunteer	United States of America	California	Los Angeles	Neutral	Joy	Twitter		6163	4694	717	RT @UCLA The number of people in need of an organ transplant continues to grow each year. This #OrganDonorDay, learn how you can make a meaningful difference in someone's life. ⬇️ https://t.co/3KQG7RA63j	Retweet		
1096184071246336001	2019-02-14 23:07:03	http://twitter.com/AngelEdOrdaz/status/1096184071246336001	"b""rt @ucla temperatures in los angeles will resemble those of cabo san lucas in the year 2080. although warmer weather sounds nice, @uclaioes's alex hall warns that climate change is more than just a shift in average temperature and precipitation."""	@AngelEdOrdaz	Angel Ordaz	United States of America	California	Los Angeles	Neutral	Neutral	Twitter	M	6212	287	814	RT @UCLA Temperatures in Los Angeles will resemble those of Cabo San Lucas in the year 2080. Although warmer weather sounds nice, @UCLAIoES's Alex Hall warns that climate change is more than just a shift in average temperature and precipitation. https://t.co/G6a0lGSmLv	Retweet		
1095888773349425153	2019-02-14 03:33:38	http://twitter.com/ashlarblocks/status/1095888773349425153	"b""rt @ucla what does the future of #freespeech look like for americas colleges and universities? join policymakers, opinion-shapers and influential academics in discussing at @ucfreespeechctr 's #speechmatters: the future of free expression on campus - march 21:"""	@ashlarblocks	Louise A. Hitchcock	United States of America			Neutral	Neutral	Twitter	F	26223	818	918	RT @UCLA What does the future of #freespeech look like for America’s colleges and universities? Join policymakers, opinion-shapers and influential academics in discussing at @ucfreespeechctr 's #SpeechMatters: The Future of Free Expression on Campus - March 21: https://t.co/UDsCr6HHtB	Retweet		
1096127912317730817	2019-02-14 19:23:54	http://twitter.com/dannymonroe9/status/1096127912317730817	"b""rt @ucla the number of people in need of an organ transplant continues to grow each year. this #organdonorday, learn how you can make a meaningful difference in someone's life."""	@dannymonroe9	Danny Courtney	United States of America			Neutral	Joy	Twitter	M	901	52	88	RT @UCLA The number of people in need of an organ transplant continues to grow each year. This #OrganDonorDay, learn how you can make a meaningful difference in someone's life. ⬇️ https://t.co/3KQG7RA63j	Retweet		
1096183677401235456	2019-02-14 23:05:29	http://twitter.com/UCLAIoES/status/1096183677401235456	"b""rt @ucla temperatures in los angeles will resemble those of cabo san lucas in the year 2080. although warmer weather sounds nice, @uclaioes's alex hall warns that climate change is more than just a shift in average temperature and precipitation."""	@UCLAIoES	UCLA Inst. of the Environment and Sustainability	United States of America	California	Los Angeles	Neutral	Neutral	Twitter		15911	6447	2457	RT @UCLA Temperatures in Los Angeles will resemble those of Cabo San Lucas in the year 2080. Although warmer weather sounds nice, @UCLAIoES's Alex Hall warns that climate change is more than just a shift in average temperature and precipitation. https://t.co/G6a0lGSmLv	Retweet		
