GUID	Date (GMT)	URL	Contents	Author	Name	Country	State/Region	City/Urban Area	Category	Emotion	Source	Gender	Posts	Followers	Following	Post Title	Post Type	Image URL	Brand	help	office	dance	money	wedding	domestic_work	sleep	medical_emergency	cold	hate	cheerfulness	aggression	occupation	envy	anticipation	family	vacation	crime	attractive	masculine	prison	health	pride	dispute	nervousness	government	weakness	horror	swearing_terms	leisure	suffering	royalty	wealthy	tourism	furniture	school	magic	beach	journalism	morning	banking	social_media	exercise	night	kill	blue_collar_job	art	ridicule	play	computer	college	optimism	stealing	real_estate	home	divine	sexual	fear	irritability	superhero	business	driving	pet	childish	cooking	exasperation	religion	hipster	internet	surprise	reading	worship	leader	independence	movement	body	noise	eating	medieval	zest	confusion	water	sports	death	healing	legend	heroic	celebration	restaurant	violence	programming	dominant_heirarchical	military	neglect	swimming	exotic	love	hiking	communication	hearing	order	sympathy	hygiene	weather	anonymity	trust	ancient	deception	fabric	air_travel	fight	dominant_personality	music	vehicle	politeness	toy	farming	meeting	war	speaking	listen	urban	shopping	disgust	fire	tool	phone	gain	sound	injury	sailing	rage	science	work	appearance	valuable	warmth	youth	sadness	fun	emotional	joy	affection	traveling	fashion	ugliness	lust	shame	torment	economics	anger	politics	ship	clothing	car	strength	technology	breaking	shape_and_size	power	white_collar_job	animal	party	terrorism	smell	disappointment	poor	plant	pain	beauty	timidity	philosophy	negotiate	negative_emotion	cleaning	messaging	competing	law	friends	payment	achievement	alcohol	liquid	feminine	weapon	children	monster	ocean	giving	contentment	writing	rural	positive_emotion	musical
1114911951686123520	2019-04-07 15:24:58	http://twitter.com/12BravoGran/status/1114911951686123520	"b'rt @amycheapho people #operationvarsityblues when they ""alleged"" to have paid $75,000 (set up to be tax-deductible, masked as a donation to the foundation of an alleged co-conspirator)... that means they got to write that off their taxes... #taxday #laundryday'"	@12BravoGran	Cody Granrud				Negative	Neutral	Twitter	M	36036	4758	4324	"RT @amycheapho People #operationvarsityblues when they ""alleged"" to have paid $75,000 (set up to be tax-deductible, masked as a donation to the foundation of an alleged co-conspirator)... that means they got to write that off their taxes...  #taxday #laundryday"	Retweet			0.0	0.0	0.0	2.0	0.0	0.0	0.0	0.0	0.0	0.0	0.0	0.0	0.0	0.0	0.0	0.0	0.0	1.0	0.0	0.0	0.0	0.0	0.0	0.0	0.0	0.0	0.0	0.0	0.0	0.0	0.0	0.0	0.0	0.0	0.0	0.0	0.0	0.0	1.0	0.0	1.0	0.0	0.0	0.0	0.0	0.0	0.0	0.0	0.0	0.0	0.0	0.0	0.0	0.0	0.0	0.0	0.0	0.0	0.0	1.0	0.0	0.0	0.0	0.0	0.0	0.0	0.0	0.0	0.0	0.0	1.0	0.0	0.0	0.0	0.0	0.0	0.0	0.0	0.0	0.0	0.0	0.0	0.0	0.0	0.0	0.0	0.0	0.0	0.0	0.0	0.0	0.0	0.0	0.0	0.0	0.0	0.0	0.0	1.0	0.0	0.0	0.0	0.0	0.0	0.0	0.0	0.0	0.0	0.0	0.0	0.0	0.0	0.0	0.0	0.0	0.0	0.0	0.0	0.0	0.0	0.0	0.0	0.0	0.0	0.0	0.0	0.0	0.0	0.0	0.0	0.0	0.0	0.0	0.0	0.0	1.0	0.0	0.0	0.0	0.0	0.0	0.0	0.0	0.0	1.0	0.0	0.0	0.0	0.0	0.0	0.0	0.0	0.0	0.0	0.0	0.0	0.0	0.0	0.0	0.0	0.0	0.0	0.0	0.0	0.0	0.0	1.0	0.0	0.0	0.0	0.0	0.0	0.0	0.0	0.0	1.0	0.0	0.0	0.0	2.0	0.0	0.0	0.0	0.0	0.0	0.0	0.0	0.0	2.0	0.0	1.0	0.0	0.0	0.0
1114749336708165632	2019-04-07 04:38:47	http://twitter.com/SelenaMarieWil3/status/1114749336708165632	b'i do not understand going to criminal lengths to get a kid into college. did they just want the kids out of the house that much? because there are easier and less expensive ways. for instance, changing the locks when they leave. #collegeadmissionsscandal #operationvarsityblues'	@SelenaMarieWil3	Selena Marie Wilson	United States of America			Negative	Sadness	Twitter	F	1219	76	58	"I don't understand going to criminal lengths to get a kid into college.
Did they just want the kids out of the house that much?
Because there are easier and less expensive ways. For instance, changing the locks when they leave.
#CollegeAdmissionsScandal
#operationvarsityblues"	Tweet			0.0	0.0	0.0	1.0	0.0	1.0	0.0	0.0	0.0	0.0	0.0	0.0	0.0	0.0	0.0	0.0	0.0	1.0	0.0	0.0	1.0	0.0	0.0	0.0	0.0	0.0	0.0	0.0	0.0	0.0	0.0	0.0	1.0	0.0	0.0	0.0	0.0	0.0	0.0	0.0	0.0	0.0	0.0	0.0	0.0	0.0	0.0	0.0	1.0	0.0	0.0	0.0	1.0	2.0	1.0	0.0	0.0	0.0	0.0	0.0	0.0	0.0	0.0	1.0	0.0	0.0	0.0	0.0	0.0	0.0	0.0	0.0	0.0	0.0	0.0	0.0	0.0	0.0	0.0	0.0	0.0	0.0	0.0	0.0	0.0	0.0	0.0	0.0	0.0	0.0	0.0	0.0	0.0	0.0	0.0	0.0	0.0	0.0	1.0	0.0	0.0	0.0	0.0	0.0	0.0	0.0	0.0	0.0	0.0	0.0	0.0	0.0	0.0	0.0	0.0	1.0	0.0	0.0	0.0	1.0	0.0	0.0	1.0	0.0	0.0	0.0	0.0	0.0	0.0	0.0	0.0	0.0	0.0	0.0	0.0	1.0	0.0	1.0	0.0	0.0	0.0	0.0	0.0	0.0	0.0	0.0	0.0	0.0	0.0	1.0	0.0	0.0	0.0	0.0	0.0	0.0	0.0	0.0	0.0	0.0	0.0	0.0	1.0	1.0	0.0	0.0	0.0	0.0	0.0	0.0	0.0	0.0	0.0	0.0	0.0	0.0	0.0	1.0	0.0	1.0	0.0	0.0	0.0	0.0	0.0	1.0	0.0	0.0	0.0	0.0	0.0	0.0	0.0	0.0
1114709767530917889	2019-04-07 02:01:33	http://twitter.com/blakcoffee/status/1114709767530917889	b'rt @makeitplain gordon caplan, accused of conspiracy to commit fraud, is one of 33 parents charged in a case that has brought scrutiny to the admissions process at prominent universities. #operationvarsityblues #getwoke #gordoncaplan'	@blakcoffee	blakcoffee	United States of America			Neutral	Neutral	Twitter		81396	849	4994	RT @MakeItPlain Gordon Caplan, accused of conspiracy to commit fraud, is one of 33 parents charged in a case that has brought scrutiny to the admissions process at prominent universities.  #OperationVarsityBlues #GetWoke #GordonCaplan  https://t.co/L2HOQ9jtrk	Retweet			0.0	0.0	0.0	0.0	0.0	0.0	0.0	0.0	0.0	0.0	0.0	0.0	0.0	0.0	0.0	1.0	0.0	2.0	0.0	0.0	0.0	0.0	0.0	0.0	0.0	0.0	0.0	0.0	0.0	0.0	0.0	0.0	0.0	0.0	0.0	0.0	0.0	0.0	0.0	0.0	0.0	0.0	0.0	0.0	0.0	0.0	0.0	0.0	0.0	0.0	0.0	0.0	1.0	0.0	0.0	0.0	0.0	0.0	0.0	0.0	0.0	0.0	0.0	0.0	0.0	0.0	0.0	0.0	0.0	0.0	0.0	0.0	0.0	0.0	0.0	0.0	0.0	0.0	0.0	0.0	0.0	0.0	0.0	0.0	0.0	0.0	0.0	0.0	0.0	0.0	0.0	0.0	0.0	0.0	0.0	0.0	0.0	0.0	0.0	0.0	0.0	0.0	0.0	0.0	0.0	0.0	0.0	0.0	0.0	0.0	0.0	0.0	0.0	0.0	0.0	0.0	0.0	0.0	0.0	0.0	0.0	0.0	0.0	0.0	0.0	0.0	0.0	0.0	0.0	0.0	0.0	0.0	0.0	0.0	0.0	0.0	0.0	0.0	0.0	0.0	0.0	0.0	0.0	0.0	0.0	0.0	0.0	0.0	0.0	0.0	0.0	1.0	0.0	0.0	0.0	0.0	0.0	0.0	0.0	0.0	0.0	0.0	0.0	1.0	0.0	0.0	0.0	0.0	0.0	0.0	0.0	0.0	0.0	0.0	0.0	0.0	0.0	0.0	0.0	0.0	0.0	0.0	0.0	0.0	0.0	0.0	0.0	0.0	0.0	0.0	0.0	0.0	0.0	0.0
1114993561693347840	2019-04-07 20:49:15	http://twitter.com/hitech_guru/status/1114993561693347840	b'#loriloughlin, #felicityhuffman could go to #prison, says #legalexpert  ? #trends #life #global #lifestyle #celebs #celebrity #realitytv #realitystar #hollywood #collegescam #collegescandals #operationvarsityblues #gordoncaplan'	@hitech_guru	Sandeep Shenoy	Canada	Ontario	Toronto	Neutral	Neutral	Twitter	M	165499	2563	1792	#LoriLoughlin, #FelicityHuffman Could Go to #Prison, Says #LegalExpert https://t.co/DBxrZ2mJH1? #Trends #Life #Global #Lifestyle #celebs #celebrity #RealityTV #RealityStar #Hollywood #collegescam #collegescandals #OperationVarsityBlues #GordonCaplan	Tweet			0.0	0.0	0.0	0.0	0.0	0.0	0.0	0.0	0.0	0.0	0.0	0.0	0.0	0.0	0.0	0.0	0.0	0.0	0.0	0.0	0.0	0.0	0.0	0.0	0.0	0.0	0.0	0.0	0.0	0.0	0.0	0.0	0.0	0.0	0.0	0.0	0.0	0.0	0.0	0.0	0.0	0.0	0.0	0.0	0.0	0.0	0.0	0.0	0.0	0.0	0.0	0.0	0.0	0.0	0.0	0.0	0.0	0.0	0.0	0.0	0.0	0.0	0.0	0.0	0.0	0.0	0.0	0.0	0.0	0.0	0.0	0.0	0.0	0.0	0.0	0.0	0.0	0.0	0.0	0.0	0.0	0.0	0.0	0.0	0.0	0.0	0.0	0.0	0.0	0.0	0.0	0.0	0.0	0.0	0.0	0.0	0.0	0.0	0.0	0.0	0.0	0.0	0.0	0.0	0.0	0.0	0.0	0.0	0.0	0.0	0.0	0.0	0.0	0.0	0.0	0.0	0.0	0.0	0.0	0.0	0.0	0.0	0.0	0.0	0.0	0.0	0.0	0.0	0.0	0.0	0.0	0.0	0.0	0.0	0.0	0.0	0.0	0.0	0.0	0.0	0.0	0.0	0.0	0.0	0.0	0.0	0.0	0.0	0.0	0.0	0.0	0.0	0.0	0.0	0.0	0.0	0.0	0.0	0.0	0.0	0.0	0.0	0.0	0.0	0.0	0.0	0.0	0.0	0.0	0.0	0.0	0.0	0.0	0.0	0.0	0.0	0.0	0.0	0.0	0.0	0.0	0.0	0.0	0.0	0.0	0.0	0.0	0.0	0.0	0.0	0.0	0.0	0.0	0.0
1114917635819495424	2019-04-07 15:47:33	http://twitter.com/RaidenRockman/status/1114917635819495424	"b'rt @amycheapho people #operationvarsityblues when they ""alleged"" to have paid $75,000 (set up to be tax-deductible, masked as a donation to the foundation of an alleged co-conspirator)... that means they got to write that off their taxes... #taxday #laundryday'"	@RaidenRockman	RockmanRaiden				Negative	Neutral	Twitter		3317	140	107	"RT @amycheapho People #operationvarsityblues when they ""alleged"" to have paid $75,000 (set up to be tax-deductible, masked as a donation to the foundation of an alleged co-conspirator)... that means they got to write that off their taxes...  #taxday #laundryday"	Retweet			0.0	0.0	0.0	2.0	0.0	0.0	0.0	0.0	0.0	0.0	0.0	0.0	0.0	0.0	0.0	0.0	0.0	1.0	0.0	0.0	0.0	0.0	0.0	0.0	0.0	0.0	0.0	0.0	0.0	0.0	0.0	0.0	0.0	0.0	0.0	0.0	0.0	0.0	1.0	0.0	1.0	0.0	0.0	0.0	0.0	0.0	0.0	0.0	0.0	0.0	0.0	0.0	0.0	0.0	0.0	0.0	0.0	0.0	0.0	1.0	0.0	0.0	0.0	0.0	0.0	0.0	0.0	0.0	0.0	0.0	1.0	0.0	0.0	0.0	0.0	0.0	0.0	0.0	0.0	0.0	0.0	0.0	0.0	0.0	0.0	0.0	0.0	0.0	0.0	0.0	0.0	0.0	0.0	0.0	0.0	0.0	0.0	0.0	1.0	0.0	0.0	0.0	0.0	0.0	0.0	0.0	0.0	0.0	0.0	0.0	0.0	0.0	0.0	0.0	0.0	0.0	0.0	0.0	0.0	0.0	0.0	0.0	0.0	0.0	0.0	0.0	0.0	0.0	0.0	0.0	0.0	0.0	0.0	0.0	0.0	1.0	0.0	0.0	0.0	0.0	0.0	0.0	0.0	0.0	1.0	0.0	0.0	0.0	0.0	0.0	0.0	0.0	0.0	0.0	0.0	0.0	0.0	0.0	0.0	0.0	0.0	0.0	0.0	0.0	0.0	0.0	1.0	0.0	0.0	0.0	0.0	0.0	0.0	0.0	0.0	1.0	0.0	0.0	0.0	2.0	0.0	0.0	0.0	0.0	0.0	0.0	0.0	0.0	2.0	0.0	1.0	0.0	0.0	0.0
1115003624160223234	2019-04-07 21:29:14	http://twitter.com/WTLocke/status/1115003624160223234	b'#harvard #fencing coach #peterbrand - fencing as in #moneylaundering? #operationvarsityblues'	@WTLocke	Tim Locke	United States of America			Neutral	Neutral	Twitter	M	7445	645	2681	#Harvard #Fencing Coach #PeterBrand - fencing as in #moneylaundering? #OperationVarsityBlues https://t.co/WaZpqvViKp	Tweet			0.0	0.0	0.0	0.0	0.0	0.0	0.0	0.0	0.0	0.0	0.0	0.0	0.0	0.0	0.0	0.0	0.0	0.0	0.0	0.0	0.0	0.0	0.0	0.0	0.0	0.0	0.0	0.0	0.0	0.0	0.0	0.0	0.0	0.0	0.0	0.0	0.0	0.0	0.0	0.0	0.0	0.0	0.0	0.0	0.0	0.0	0.0	0.0	0.0	0.0	0.0	0.0	0.0	0.0	0.0	0.0	0.0	0.0	0.0	0.0	0.0	0.0	0.0	0.0	0.0	0.0	0.0	0.0	0.0	0.0	0.0	0.0	0.0	0.0	0.0	0.0	0.0	0.0	0.0	0.0	0.0	0.0	2.0	0.0	0.0	0.0	0.0	0.0	0.0	0.0	0.0	0.0	0.0	0.0	0.0	0.0	0.0	0.0	0.0	0.0	0.0	0.0	0.0	0.0	0.0	0.0	0.0	0.0	0.0	0.0	0.0	0.0	0.0	0.0	0.0	0.0	0.0	0.0	0.0	0.0	0.0	0.0	0.0	0.0	0.0	0.0	0.0	0.0	0.0	0.0	0.0	0.0	0.0	0.0	0.0	0.0	0.0	0.0	0.0	0.0	0.0	0.0	0.0	0.0	0.0	0.0	0.0	0.0	0.0	0.0	0.0	0.0	0.0	0.0	0.0	0.0	0.0	0.0	0.0	0.0	0.0	0.0	0.0	0.0	0.0	0.0	0.0	0.0	0.0	0.0	0.0	0.0	0.0	0.0	0.0	0.0	0.0	0.0	0.0	0.0	0.0	0.0	0.0	0.0	0.0	0.0	0.0	0.0	0.0	0.0	0.0	0.0	0.0	0.0
1114911752406200328	2019-04-07 15:24:10	http://twitter.com/amycheapho/status/1114911752406200328	"b'people #operationvarsityblues when they ""alleged"" to have paid $75,000 (set up to be tax-deductible, masked as a donation to the foundation of an alleged co-conspirator)... that means they got to write that off their taxes... #taxday #laundryday'"	@amycheapho	Amy Cheapho	United States of America	California	Los Angeles	Negative	Unclassified	Twitter	F	18222	12109	744	"People #operationvarsityblues when they ""alleged"" to have paid $75,000 (set up to be tax-deductible, masked as a donation to the foundation of an alleged co-conspirator)... that means they got to write that off their taxes...  #taxday #laundryday"	Tweet			0.0	0.0	0.0	2.0	0.0	0.0	0.0	0.0	0.0	0.0	0.0	0.0	0.0	0.0	0.0	0.0	0.0	1.0	0.0	0.0	0.0	0.0	0.0	0.0	0.0	0.0	0.0	0.0	0.0	0.0	0.0	0.0	0.0	0.0	0.0	0.0	0.0	0.0	1.0	0.0	1.0	0.0	0.0	0.0	0.0	0.0	0.0	0.0	0.0	0.0	0.0	0.0	0.0	0.0	0.0	0.0	0.0	0.0	0.0	1.0	0.0	0.0	0.0	0.0	0.0	0.0	0.0	0.0	0.0	0.0	1.0	0.0	0.0	0.0	0.0	0.0	0.0	0.0	0.0	0.0	0.0	0.0	0.0	0.0	0.0	0.0	0.0	0.0	0.0	0.0	0.0	0.0	0.0	0.0	0.0	0.0	0.0	0.0	1.0	0.0	0.0	0.0	0.0	0.0	0.0	0.0	0.0	0.0	0.0	0.0	0.0	0.0	0.0	0.0	0.0	0.0	0.0	0.0	0.0	0.0	0.0	0.0	0.0	0.0	0.0	0.0	0.0	0.0	0.0	0.0	0.0	0.0	0.0	0.0	0.0	1.0	0.0	0.0	0.0	0.0	0.0	0.0	0.0	0.0	1.0	0.0	0.0	0.0	0.0	0.0	0.0	0.0	0.0	0.0	0.0	0.0	0.0	0.0	0.0	0.0	0.0	0.0	0.0	0.0	0.0	0.0	1.0	0.0	0.0	0.0	0.0	0.0	0.0	0.0	0.0	1.0	0.0	0.0	0.0	2.0	0.0	0.0	0.0	0.0	0.0	0.0	0.0	0.0	2.0	0.0	1.0	0.0	0.0	0.0
1114974938039898112	2019-04-07 19:35:15	http://twitter.com/RaiseURH/status/1114974938039898112	b'gordon caplan, new york attorney, pleads guilty in college admissions scandal   via @cbsnews follow suit, others. he is an attorney who is pleading guilty #operationvarsityblues #maga'	@RaiseURH	Raise ur Right Hand	United States of America	California		Neutral	Neutral	Twitter		69549	8888	9102	"Gordon Caplan, New York attorney, pleads guilty in college admissions scandal https://t.co/04JC4fmlse via @CBSNews
FOLLOW SUIT, OTHERS. HE'S AN ATTORNEY WHO'S PLEADING GUILTY
#OperationVarsityBlues #MAGA"	Tweet			0.0	0.0	0.0	0.0	0.0	0.0	0.0	0.0	0.0	0.0	0.0	0.0	1.0	0.0	0.0	0.0	0.0	0.0	0.0	0.0	0.0	0.0	0.0	0.0	0.0	0.0	0.0	0.0	0.0	0.0	0.0	0.0	0.0	0.0	0.0	1.0	0.0	0.0	0.0	0.0	0.0	1.0	0.0	0.0	0.0	0.0	0.0	0.0	0.0	0.0	1.0	0.0	0.0	0.0	0.0	0.0	0.0	0.0	0.0	0.0	0.0	0.0	0.0	0.0	0.0	0.0	0.0	0.0	0.0	0.0	0.0	0.0	0.0	0.0	0.0	0.0	0.0	0.0	0.0	0.0	0.0	0.0	0.0	0.0	0.0	0.0	0.0	0.0	0.0	0.0	0.0	0.0	0.0	0.0	0.0	0.0	0.0	0.0	0.0	0.0	1.0	0.0	0.0	0.0	0.0	0.0	0.0	0.0	0.0	0.0	0.0	0.0	0.0	0.0	0.0	0.0	0.0	0.0	0.0	0.0	0.0	0.0	0.0	0.0	0.0	0.0	0.0	0.0	0.0	0.0	0.0	0.0	0.0	0.0	0.0	0.0	0.0	0.0	0.0	0.0	2.0	0.0	0.0	0.0	0.0	0.0	0.0	2.0	0.0	0.0	0.0	0.0	0.0	0.0	0.0	0.0	0.0	0.0	0.0	0.0	1.0	0.0	0.0	0.0	0.0	0.0	0.0	0.0	0.0	0.0	0.0	0.0	0.0	2.0	0.0	1.0	0.0	1.0	0.0	0.0	0.0	0.0	0.0	0.0	0.0	0.0	0.0	0.0	0.0	0.0	0.0	0.0	0.0	0.0
1114742154914664448	2019-04-07 04:10:15	http://twitter.com/TBlackwe85/status/1114742154914664448	b'holy mother of christ! the #collegeadmissionscandal, a.k.a. #operationvarsityblues is going to turn #loriloughlin and #felicityhuffman into class clowns  but the @fbi, local law enforcement and prosecutors are not the only ones laughing and crunching the numbers very slightly'	@TBlackwe85	Terrence L. Blackwell, Esq.	United States of America	Maryland		Positive	Fear	Twitter	M	116688	582	4997	Holy mother of Christ! The #CollegeAdmissionScandal, a.k.a. #OperationVarsityBlues is going to turn #LoriLoughlin and #FelicityHuffman into  class clowns 🤡 but the @FBI, local law enforcement and prosecutors aren’t the only ones laughing and crunching the numbers very slightly	Tweet			0.0	0.0	0.0	0.0	0.0	0.0	0.0	0.0	0.0	0.0	0.0	0.0	0.0	0.0	0.0	1.0	0.0	2.0	0.0	0.0	0.0	0.0	0.0	1.0	0.0	2.0	0.0	0.0	0.0	0.0	0.0	0.0	0.0	0.0	0.0	1.0	0.0	0.0	0.0	0.0	0.0	0.0	0.0	0.0	0.0	0.0	0.0	0.0	0.0	0.0	1.0	0.0	1.0	1.0	1.0	0.0	0.0	0.0	0.0	0.0	1.0	0.0	0.0	0.0	0.0	0.0	0.0	0.0	0.0	0.0	1.0	0.0	0.0	0.0	1.0	0.0	1.0	0.0	0.0	0.0	0.0	0.0	0.0	0.0	0.0	0.0	0.0	0.0	0.0	0.0	0.0	0.0	0.0	0.0	0.0	0.0	0.0	0.0	0.0	0.0	0.0	0.0	0.0	0.0	0.0	0.0	0.0	0.0	0.0	0.0	0.0	0.0	0.0	0.0	0.0	0.0	0.0	1.0	0.0	0.0	0.0	1.0	0.0	0.0	0.0	0.0	0.0	0.0	1.0	0.0	0.0	0.0	1.0	0.0	0.0	0.0	0.0	0.0	0.0	0.0	0.0	0.0	0.0	0.0	0.0	0.0	0.0	0.0	0.0	0.0	0.0	0.0	0.0	0.0	0.0	0.0	0.0	0.0	0.0	1.0	1.0	0.0	0.0	0.0	0.0	0.0	0.0	0.0	0.0	0.0	0.0	0.0	0.0	0.0	0.0	0.0	0.0	2.0	0.0	0.0	0.0	0.0	0.0	0.0	0.0	1.0	0.0	0.0	0.0	0.0	0.0	0.0	0.0	0.0
1114756404777107456	2019-04-07 05:06:52	http://twitter.com/urkgurgle/status/1114756404777107456	b'rt @reloaded_kore gordon caplan, accused of conspiracy to commit fraud, is one of 33 parents charged in a case that has brought scrutiny to the admissions process at prominent universities. #operationvarsityblues #getwoke #gordoncaplan'	@urkgurgle	Changing the world				Neutral	Neutral	Twitter		30711	1172	1418	RT @Reloaded_Kore Gordon Caplan, accused of conspiracy to commit fraud, is one of 33 parents charged in a case that has brought scrutiny to the admissions process at prominent universities.  #OperationVarsityBlues #GetWoke #GordonCaplan  https://t.co/J1KaDa4Pyf	Retweet			0.0	0.0	0.0	0.0	0.0	0.0	0.0	0.0	0.0	0.0	0.0	0.0	0.0	0.0	0.0	1.0	0.0	2.0	0.0	0.0	0.0	0.0	0.0	0.0	0.0	0.0	0.0	0.0	0.0	0.0	0.0	0.0	0.0	0.0	0.0	0.0	0.0	0.0	0.0	0.0	0.0	0.0	0.0	0.0	0.0	0.0	0.0	0.0	0.0	0.0	0.0	0.0	1.0	0.0	0.0	0.0	0.0	0.0	0.0	0.0	0.0	0.0	0.0	0.0	0.0	0.0	0.0	0.0	0.0	0.0	0.0	0.0	0.0	0.0	0.0	0.0	0.0	0.0	0.0	0.0	0.0	0.0	0.0	0.0	0.0	0.0	0.0	0.0	0.0	0.0	0.0	0.0	0.0	0.0	0.0	0.0	0.0	0.0	0.0	0.0	0.0	0.0	0.0	0.0	0.0	0.0	0.0	0.0	0.0	0.0	0.0	0.0	0.0	0.0	0.0	0.0	0.0	0.0	0.0	0.0	0.0	0.0	0.0	0.0	0.0	0.0	0.0	0.0	0.0	0.0	0.0	0.0	0.0	0.0	0.0	0.0	0.0	0.0	0.0	0.0	0.0	0.0	0.0	0.0	0.0	0.0	0.0	0.0	0.0	0.0	0.0	1.0	0.0	0.0	0.0	0.0	0.0	0.0	0.0	0.0	0.0	0.0	0.0	1.0	0.0	0.0	0.0	0.0	0.0	0.0	0.0	0.0	0.0	0.0	0.0	0.0	0.0	0.0	0.0	0.0	0.0	0.0	0.0	0.0	0.0	0.0	0.0	0.0	0.0	0.0	0.0	0.0	0.0	0.0
1114708169614348288	2019-04-07 01:55:12	http://twitter.com/Reloaded_Kore/status/1114708169614348288	b'gordon caplan, accused of conspiracy to commit fraud, is one of 33 parents charged in a case that has brought scrutiny to the admissions process at prominent universities. #operationvarsityblues #getwoke #gordoncaplan'	@Reloaded_Kore	The Kore: Reloaded 🥁📰🗞️🔎 🇺🇸🌍	United States of America	New York	New York	Neutral	Unclassified	Twitter		70757	1690	4365	Gordon Caplan, accused of conspiracy to commit fraud, is one of 33 parents charged in a case that has brought scrutiny to the admissions process at prominent universities.  #OperationVarsityBlues #GetWoke #GordonCaplan  https://t.co/J1KaDa4Pyf	Tweet			0.0	0.0	0.0	0.0	0.0	0.0	0.0	0.0	0.0	0.0	0.0	0.0	0.0	0.0	0.0	1.0	0.0	2.0	0.0	0.0	0.0	0.0	0.0	0.0	0.0	0.0	0.0	0.0	0.0	0.0	0.0	0.0	0.0	0.0	0.0	0.0	0.0	0.0	0.0	0.0	0.0	0.0	0.0	0.0	0.0	0.0	0.0	0.0	0.0	0.0	0.0	0.0	1.0	0.0	0.0	0.0	0.0	0.0	0.0	0.0	0.0	0.0	0.0	0.0	0.0	0.0	0.0	0.0	0.0	0.0	0.0	0.0	0.0	0.0	0.0	0.0	0.0	0.0	0.0	0.0	0.0	0.0	0.0	0.0	0.0	0.0	0.0	0.0	0.0	0.0	0.0	0.0	0.0	0.0	0.0	0.0	0.0	0.0	0.0	0.0	0.0	0.0	0.0	0.0	0.0	0.0	0.0	0.0	0.0	0.0	0.0	0.0	0.0	0.0	0.0	0.0	0.0	0.0	0.0	0.0	0.0	0.0	0.0	0.0	0.0	0.0	0.0	0.0	0.0	0.0	0.0	0.0	0.0	0.0	0.0	0.0	0.0	0.0	0.0	0.0	0.0	0.0	0.0	0.0	0.0	0.0	0.0	0.0	0.0	0.0	0.0	1.0	0.0	0.0	0.0	0.0	0.0	0.0	0.0	0.0	0.0	0.0	0.0	1.0	0.0	0.0	0.0	0.0	0.0	0.0	0.0	0.0	0.0	0.0	0.0	0.0	0.0	0.0	0.0	0.0	0.0	0.0	0.0	0.0	0.0	0.0	0.0	0.0	0.0	0.0	0.0	0.0	0.0	0.0
1114744634318708736	2019-04-07 04:20:06	http://twitter.com/TBlackwe85/status/1114744634318708736	b'rt @reloaded_kore gordon caplan, accused of conspiracy to commit fraud, is one of 33 parents charged in a case that has brought scrutiny to the admissions process at prominent universities. #operationvarsityblues #getwoke #gordoncaplan'	@TBlackwe85	Terrence L. Blackwell, Esq.	United States of America	Maryland		Neutral	Neutral	Twitter	M	116701	582	4997	RT @Reloaded_Kore Gordon Caplan, accused of conspiracy to commit fraud, is one of 33 parents charged in a case that has brought scrutiny to the admissions process at prominent universities.  #OperationVarsityBlues #GetWoke #GordonCaplan  https://t.co/J1KaDa4Pyf	Retweet			0.0	0.0	0.0	0.0	0.0	0.0	0.0	0.0	0.0	0.0	0.0	0.0	0.0	0.0	0.0	1.0	0.0	2.0	0.0	0.0	0.0	0.0	0.0	0.0	0.0	0.0	0.0	0.0	0.0	0.0	0.0	0.0	0.0	0.0	0.0	0.0	0.0	0.0	0.0	0.0	0.0	0.0	0.0	0.0	0.0	0.0	0.0	0.0	0.0	0.0	0.0	0.0	1.0	0.0	0.0	0.0	0.0	0.0	0.0	0.0	0.0	0.0	0.0	0.0	0.0	0.0	0.0	0.0	0.0	0.0	0.0	0.0	0.0	0.0	0.0	0.0	0.0	0.0	0.0	0.0	0.0	0.0	0.0	0.0	0.0	0.0	0.0	0.0	0.0	0.0	0.0	0.0	0.0	0.0	0.0	0.0	0.0	0.0	0.0	0.0	0.0	0.0	0.0	0.0	0.0	0.0	0.0	0.0	0.0	0.0	0.0	0.0	0.0	0.0	0.0	0.0	0.0	0.0	0.0	0.0	0.0	0.0	0.0	0.0	0.0	0.0	0.0	0.0	0.0	0.0	0.0	0.0	0.0	0.0	0.0	0.0	0.0	0.0	0.0	0.0	0.0	0.0	0.0	0.0	0.0	0.0	0.0	0.0	0.0	0.0	0.0	1.0	0.0	0.0	0.0	0.0	0.0	0.0	0.0	0.0	0.0	0.0	0.0	1.0	0.0	0.0	0.0	0.0	0.0	0.0	0.0	0.0	0.0	0.0	0.0	0.0	0.0	0.0	0.0	0.0	0.0	0.0	0.0	0.0	0.0	0.0	0.0	0.0	0.0	0.0	0.0	0.0	0.0	0.0
1114839620334891009	2019-04-07 10:37:32	http://twitter.com/margarettehattl/status/1114839620334891009	b'rt @billmaher on this college admissions scandal, everyone is talking about. i have shocking news for everyone: rich people cheat, and their kids are fucking stupid. #operationvarsityblues'	@margarettehattl	Margarette	United States of America	Washington	Tacoma	Negative	Disgust	Twitter	F	177	81	779	RT @billmaher On this college admissions scandal, everyone is talking about. I have shocking news for everyone: rich people cheat, and their kids are fucking stupid. #OperationVarsityBlues https://t.co/nbVjRYhM3x	Retweet			0.0	0.0	0.0	0.0	0.0	0.0	0.0	0.0	0.0	0.0	0.0	0.0	0.0	0.0	0.0	0.0	0.0	0.0	0.0	0.0	0.0	0.0	0.0	0.0	0.0	0.0	0.0	0.0	0.0	0.0	0.0	0.0	1.0	0.0	0.0	1.0	0.0	0.0	0.0	0.0	1.0	0.0	0.0	0.0	0.0	0.0	0.0	0.0	0.0	0.0	1.0	0.0	0.0	0.0	0.0	0.0	0.0	0.0	0.0	0.0	0.0	0.0	0.0	0.0	0.0	0.0	0.0	0.0	0.0	1.0	0.0	0.0	0.0	0.0	0.0	0.0	0.0	0.0	0.0	0.0	0.0	0.0	0.0	0.0	0.0	0.0	0.0	0.0	0.0	0.0	0.0	0.0	0.0	0.0	0.0	0.0	0.0	0.0	1.0	1.0	0.0	0.0	0.0	0.0	0.0	0.0	0.0	0.0	0.0	0.0	0.0	0.0	0.0	0.0	0.0	0.0	0.0	0.0	0.0	1.0	1.0	0.0	0.0	0.0	0.0	0.0	0.0	0.0	0.0	0.0	0.0	0.0	0.0	0.0	0.0	0.0	0.0	0.0	0.0	0.0	0.0	0.0	0.0	0.0	0.0	0.0	0.0	0.0	0.0	0.0	0.0	0.0	0.0	0.0	0.0	0.0	0.0	0.0	0.0	0.0	0.0	0.0	0.0	0.0	0.0	0.0	0.0	0.0	0.0	0.0	0.0	0.0	0.0	1.0	0.0	0.0	0.0	0.0	0.0	0.0	0.0	0.0	0.0	0.0	0.0	0.0	0.0	0.0	0.0	0.0	0.0	0.0	0.0	0.0
1114708168947449858	2019-04-07 01:55:12	http://twitter.com/MakeItPlain/status/1114708168947449858	b'gordon caplan, accused of conspiracy to commit fraud, is one of 33 parents charged in a case that has brought scrutiny to the admissions process at prominent universities. #operationvarsityblues #getwoke #gordoncaplan'	@MakeItPlain	6-9a ET #GetWoke⏰ #MIP🎙️ #GetWokeAndVote🗳️	United States of America	New York	New York	Neutral	Unclassified	Twitter		128941	20312	2770	Gordon Caplan, accused of conspiracy to commit fraud, is one of 33 parents charged in a case that has brought scrutiny to the admissions process at prominent universities.  #OperationVarsityBlues #GetWoke #GordonCaplan  https://t.co/L2HOQ9jtrk	Tweet			0.0	0.0	0.0	0.0	0.0	0.0	0.0	0.0	0.0	0.0	0.0	0.0	0.0	0.0	0.0	1.0	0.0	2.0	0.0	0.0	0.0	0.0	0.0	0.0	0.0	0.0	0.0	0.0	0.0	0.0	0.0	0.0	0.0	0.0	0.0	0.0	0.0	0.0	0.0	0.0	0.0	0.0	0.0	0.0	0.0	0.0	0.0	0.0	0.0	0.0	0.0	0.0	1.0	0.0	0.0	0.0	0.0	0.0	0.0	0.0	0.0	0.0	0.0	0.0	0.0	0.0	0.0	0.0	0.0	0.0	0.0	0.0	0.0	0.0	0.0	0.0	0.0	0.0	0.0	0.0	0.0	0.0	0.0	0.0	0.0	0.0	0.0	0.0	0.0	0.0	0.0	0.0	0.0	0.0	0.0	0.0	0.0	0.0	0.0	0.0	0.0	0.0	0.0	0.0	0.0	0.0	0.0	0.0	0.0	0.0	0.0	0.0	0.0	0.0	0.0	0.0	0.0	0.0	0.0	0.0	0.0	0.0	0.0	0.0	0.0	0.0	0.0	0.0	0.0	0.0	0.0	0.0	0.0	0.0	0.0	0.0	0.0	0.0	0.0	0.0	0.0	0.0	0.0	0.0	0.0	0.0	0.0	0.0	0.0	0.0	0.0	1.0	0.0	0.0	0.0	0.0	0.0	0.0	0.0	0.0	0.0	0.0	0.0	1.0	0.0	0.0	0.0	0.0	0.0	0.0	0.0	0.0	0.0	0.0	0.0	0.0	0.0	0.0	0.0	0.0	0.0	0.0	0.0	0.0	0.0	0.0	0.0	0.0	0.0	0.0	0.0	0.0	0.0	0.0
1115035021411119104	2019-04-07 23:34:00	http://twitter.com/Momepreneurs/status/1115035021411119104	b'why do incredibly gifted and talented people molest the gift in them? ja rule fyre festival billy mcfarland felicity huffman #lorilaughlin #williamsinger #operationvarsityblues #collegeadmissionscandal #proverbs31 take a listen:'	@Momepreneurs	Mom-e-Preneurs	United States of America	California		Neutral	Joy	Twitter		2285	1094	1511	"Why do incredibly gifted and talented people molest the gift in them? 
Ja Rule
Fyre Festival
Billy Mcfarland
Felicity Huffman
#LoriLaughlin
#WilliamSinger
#OperationVarsityBlues
#CollegeAdmissionScandal
#Proverbs31

Take a Listen: 
https://t.co/zXfJs0Vbid"	Tweet			0.0	0.0	0.0	0.0	1.0	0.0	0.0	0.0	0.0	0.0	0.0	0.0	0.0	0.0	0.0	0.0	0.0	0.0	0.0	0.0	0.0	0.0	0.0	0.0	0.0	1.0	0.0	0.0	0.0	0.0	0.0	1.0	0.0	0.0	0.0	0.0	1.0	0.0	0.0	0.0	0.0	0.0	0.0	0.0	0.0	0.0	0.0	0.0	0.0	0.0	0.0	0.0	0.0	0.0	0.0	0.0	0.0	0.0	0.0	0.0	0.0	0.0	0.0	0.0	0.0	0.0	0.0	0.0	0.0	0.0	0.0	0.0	1.0	0.0	0.0	0.0	0.0	0.0	0.0	0.0	0.0	0.0	0.0	0.0	0.0	0.0	0.0	2.0	0.0	0.0	0.0	0.0	0.0	0.0	0.0	0.0	0.0	0.0	0.0	0.0	1.0	0.0	0.0	0.0	0.0	0.0	0.0	0.0	0.0	0.0	0.0	0.0	0.0	0.0	0.0	0.0	0.0	0.0	0.0	0.0	0.0	0.0	0.0	0.0	0.0	0.0	0.0	0.0	0.0	0.0	0.0	0.0	0.0	0.0	0.0	0.0	0.0	0.0	0.0	0.0	0.0	0.0	0.0	0.0	0.0	0.0	0.0	0.0	0.0	0.0	0.0	0.0	0.0	0.0	0.0	0.0	0.0	0.0	0.0	1.0	0.0	0.0	2.0	0.0	0.0	0.0	0.0	0.0	0.0	0.0	0.0	0.0	0.0	0.0	0.0	0.0	0.0	1.0	0.0	0.0	0.0	0.0	0.0	0.0	0.0	0.0	0.0	0.0	1.0	0.0	0.0	0.0	0.0	1.0
1114992935316217862	2019-04-07 20:46:46	http://twitter.com/briankellykelly/status/1114992935316217862	"b'florida man who bribed his son into upenn found guilty of ""largest healthcare fraud ever"" #medicare #operationvarsityblues'"	@briankellykelly	#StillRanding ⭐️⭐️⭐️				Negative	Disgust	Twitter		50899	3182	3111	"Florida Man Who Bribed His Son Into UPenn Found Guilty Of ""Largest Healthcare Fraud Ever"" #Medicare #OperationVarsityBlues https://t.co/kZRuoWRQCP"	Tweet			0.0	0.0	0.0	0.0	1.0	0.0	0.0	0.0	0.0	0.0	0.0	0.0	0.0	0.0	0.0	1.0	0.0	1.0	0.0	1.0	0.0	0.0	0.0	0.0	0.0	0.0	0.0	0.0	0.0	0.0	0.0	0.0	0.0	0.0	0.0	0.0	0.0	0.0	0.0	0.0	0.0	0.0	0.0	0.0	0.0	0.0	0.0	0.0	0.0	0.0	0.0	0.0	1.0	0.0	0.0	0.0	0.0	0.0	0.0	0.0	0.0	0.0	0.0	0.0	0.0	0.0	0.0	0.0	0.0	0.0	0.0	0.0	0.0	0.0	0.0	0.0	0.0	0.0	0.0	0.0	0.0	0.0	0.0	1.0	0.0	0.0	0.0	0.0	0.0	0.0	0.0	0.0	0.0	0.0	0.0	0.0	0.0	0.0	0.0	0.0	0.0	0.0	0.0	0.0	0.0	0.0	0.0	1.0	0.0	0.0	0.0	0.0	0.0	0.0	0.0	0.0	0.0	0.0	0.0	0.0	0.0	0.0	0.0	0.0	0.0	0.0	0.0	0.0	0.0	0.0	0.0	0.0	0.0	0.0	0.0	0.0	0.0	1.0	0.0	0.0	0.0	0.0	0.0	0.0	0.0	0.0	0.0	1.0	0.0	0.0	0.0	0.0	0.0	0.0	0.0	0.0	0.0	0.0	0.0	0.0	0.0	0.0	0.0	0.0	0.0	0.0	0.0	0.0	0.0	0.0	0.0	0.0	0.0	1.0	0.0	0.0	0.0	0.0	0.0	0.0	0.0	0.0	0.0	0.0	0.0	1.0	0.0	0.0	0.0	0.0	0.0	0.0	0.0	0.0
