GUID	Date (GMT)	URL	Contents	Author	Name	Country	State/Region	City/Urban Area	Category	Emotion	Source	Gender	Posts	Followers	Following	Post Title	Post Type	Image URL	Brand
1100598207850168320	2019-02-27 03:27:15	http://twitter.com/HayleyWielgus/status/1100598207850168320	RT @NorthwesternU Ahead of the #Chicago mayoral election tonight, read @MedillSchool Prof. @peterdslevin's reporting in @NewYorker on the nuances of Chicago politics and the outsiders trying to shake up the system. https://t.co/pBC02f7LVA https://t.co/vh5pWU6Idf	@HayleyWielgus	Hayley Wielgus	United States of America	Tennessee	Nashville	Neutral	Neutral	Twitter	F	21931	1930	732	RT @NorthwesternU Ahead of the #Chicago mayoral election tonight, read @MedillSchool Prof. @peterdslevin's reporting in @NewYorker on the nuances of Chicago politics and the outsiders trying to shake up the system. https://t.co/pBC02f7LVA https://t.co/vh5pWU6Idf	Retweet		
1100595026311172096	2019-02-27 03:14:36	http://twitter.com/Medill_Doc/status/1100595026311172096	RT @NorthwesternU Ahead of the #Chicago mayoral election tonight, read @MedillSchool Prof. @peterdslevin's reporting in @NewYorker on the nuances of Chicago politics and the outsiders trying to shake up the system. https://t.co/pBC02f7LVA https://t.co/vh5pWU6Idf	@Medill_Doc	Medill Documentary	United States of America	Illinois	Chicago	Neutral	Neutral	Twitter		6648	3889	5573	RT @NorthwesternU Ahead of the #Chicago mayoral election tonight, read @MedillSchool Prof. @peterdslevin's reporting in @NewYorker on the nuances of Chicago politics and the outsiders trying to shake up the system. https://t.co/pBC02f7LVA https://t.co/vh5pWU6Idf	Retweet		
1100802002668335105	2019-02-27 16:57:04	http://twitter.com/HigleyCollegeGo/status/1100802002668335105	RT @NorthwesternU The diversity gap is wide in #coding. However, thanks to apps like TunePad, which allows users to create musical compositions via the computer programming language Python, coding has become more accessible and entertaining. https://t.co/EEBCMS2T4X https://t.co/m1OmYiKzYJ	@HigleyCollegeGo	HUSD	United States of America	Arizona		Positive	Neutral	Twitter		3452	147	139	RT @NorthwesternU The diversity gap is wide in #coding. However, thanks to apps like TunePad, which allows users to create musical compositions via the computer programming language Python, coding has become more accessible and entertaining. https://t.co/EEBCMS2T4X https://t.co/m1OmYiKzYJ	Retweet		
1100821143752196102	2019-02-27 18:13:07	http://twitter.com/tremendous3/status/1100821143752196102	RT @NorthwesternU The diversity gap is wide in #coding. However, thanks to apps like TunePad, which allows users to create musical compositions via the computer programming language Python, coding has become more accessible and entertaining. https://t.co/EEBCMS2T4X https://t.co/m1OmYiKzYJ	@tremendous3	tremendous3	United States of America			Positive	Neutral	Twitter		14551	475	636	RT @NorthwesternU The diversity gap is wide in #coding. However, thanks to apps like TunePad, which allows users to create musical compositions via the computer programming language Python, coding has become more accessible and entertaining. https://t.co/EEBCMS2T4X https://t.co/m1OmYiKzYJ	Retweet		
1100572818008391681	2019-02-27 01:46:22	http://twitter.com/Spoilingann/status/1100572818008391681	RT @NorthwesternU Voters with four-year degrees, especially those in humanities, are more likely to vote in favor of #Medicaid expansion, regardless of political affiliation. https://t.co/EQ4BUHNVrL https://t.co/9eBslSsTFF	@Spoilingann	Ann Works				Neutral	Neutral	Twitter	F	2137	116	1095	RT @NorthwesternU Voters with four-year degrees, especially those in humanities, are more likely to vote in favor of #Medicaid expansion, regardless of political affiliation. https://t.co/EQ4BUHNVrL https://t.co/9eBslSsTFF	Retweet		
1100802961238867968	2019-02-27 17:00:52	http://twitter.com/justinetlai/status/1100802961238867968	"RT @NorthwesternU Nearly all of Georgia O'Keeffe's paintings are infected with ""art acne."" Northwestern researchers are using pocket-sized technology to diagnose and help save the O'Keeffes. https://t.co/DFtewMrk4w https://t.co/H8jjdjwZ2L"	@justinetlai	justine				Neutral	Neutral	Twitter	F	3385	209	321	"RT @NorthwesternU Nearly all of Georgia O'Keeffe's paintings are infected with ""art acne."" Northwestern researchers are using pocket-sized technology to diagnose and help save the O'Keeffes. https://t.co/DFtewMrk4w https://t.co/H8jjdjwZ2L"	Retweet		
