GUID	Date (GMT)	URL	Contents	Author	Name	Country	State/Region	City/Urban Area	Category	Emotion	Source	Gender	Posts	Followers	Following	Influence Score	Post Title	Post Type	Image URL	Brand	help	office	dance	money	wedding	domestic_work	sleep	medical_emergency	cold	hate	cheerfulness	aggression	occupation	envy	anticipation	family	vacation	crime	attractive	masculine	prison	health	pride	dispute	nervousness	government	weakness	horror	swearing_terms	leisure	suffering	royalty	wealthy	tourism	furniture	school	magic	beach	journalism	morning	banking	social_media	exercise	night	kill	blue_collar_job	art	ridicule	play	computer	college	optimism	stealing	real_estate	home	divine	sexual	fear	irritability	superhero	business	driving	pet	childish	cooking	exasperation	religion	hipster	internet	surprise	reading	worship	leader	independence	movement	body	noise	eating	medieval	zest	confusion	water	sports	death	healing	legend	heroic	celebration	restaurant	violence	programming	dominant_heirarchical	military	neglect	swimming	exotic	love	hiking	communication	hearing	order	sympathy	hygiene	weather	anonymity	trust	ancient	deception	fabric	air_travel	fight	dominant_personality	music	vehicle	politeness	toy	farming	meeting	war	speaking	listen	urban	shopping	disgust	fire	tool	phone	gain	sound	injury	sailing	rage	science	work	appearance	valuable	warmth	youth	sadness	fun	emotional	joy	affection	traveling	fashion	ugliness	lust	shame	torment	economics	anger	politics	ship	clothing	car	strength	technology	breaking	shape_and_size	power	white_collar_job	animal	party	terrorism	smell	disappointment	poor	plant	pain	beauty	timidity	philosophy	negotiate	negative_emotion	cleaning	messaging	competing	law	friends	payment	achievement	alcohol	liquid	feminine	weapon	children	monster	ocean	giving	contentment	writing	rural	positive_emotion	musical
1120808859382308864		http://twitter.com/candy_yeldham/status/1120808859382308864	b'rt @samantharonson no publicity is bad, felicity. #operationvarsityblues'	@candy_yeldham	Candy Yeldham   🇬🇧®️🏁🤘	United Kingdom	Greater London	London	Neutral	Neutral	Twitter	F					RT @samantharonson “No publicity is bad, felicity.” #OperationVarsityBlues	Retweet			0.0	0.0	0.0	0.0	0.0	0.0	0.0	0.0	0.0	0.0	0.0	0.0	0.0	0.0	0.0	0.0	0.0	0.0	0.0	0.0	0.0	0.0	0.0	0.0	0.0	0.0	0.0	0.0	0.0	0.0	0.0	0.0	0.0	0.0	0.0	0.0	0.0	0.0	0.0	0.0	0.0	0.0	0.0	0.0	0.0	0.0	0.0	0.0	0.0	0.0	0.0	0.0	0.0	0.0	0.0	0.0	0.0	0.0	0.0	0.0	0.0	0.0	0.0	0.0	0.0	0.0	0.0	0.0	0.0	0.0	0.0	0.0	0.0	0.0	0.0	0.0	0.0	0.0	0.0	0.0	0.0	0.0	0.0	0.0	0.0	0.0	0.0	0.0	0.0	0.0	0.0	0.0	0.0	0.0	0.0	0.0	0.0	0.0	0.0	0.0	0.0	0.0	0.0	0.0	0.0	0.0	0.0	0.0	0.0	0.0	0.0	0.0	0.0	0.0	0.0	0.0	0.0	0.0	0.0	0.0	0.0	0.0	0.0	0.0	0.0	0.0	0.0	0.0	0.0	0.0	0.0	0.0	0.0	0.0	0.0	0.0	0.0	0.0	0.0	0.0	0.0	0.0	0.0	0.0	0.0	0.0	0.0	0.0	0.0	0.0	0.0	0.0	0.0	0.0	0.0	0.0	0.0	0.0	0.0	0.0	0.0	0.0	0.0	0.0	0.0	0.0	0.0	0.0	0.0	0.0	0.0	0.0	0.0	0.0	0.0	0.0	0.0	0.0	0.0	0.0	0.0	0.0	0.0	0.0	0.0	0.0	0.0	0.0	0.0	0.0	0.0	0.0	0.0	0.0
1120706795515678720		http://twitter.com/M_a_d_w_a_c_k/status/1120706795515678720	b'rt @thebreakernews in #operationvarsityblues, ex-usc assistant soccer coach laura janke, 36, of north hollywood, to plead guilty to conspiracy to commit racketeering. ex-title insurance exec toby macfarlane, 56, of del mar, calif., to plead guilty to conspiracy to commit mail fraud.'	@M_a_d_w_a_c_k	R U FAKE NEWS? 🇨🇦⭐️⭐️⭐️🇨🇦				Negative	Neutral	Twitter						RT @theBreakerNews In #OperationVarsityBlues, ex-USC assistant soccer coach Laura Janke, 36, of North Hollywood, to plead guilty to conspiracy to commit racketeering. Ex-title insurance exec Toby MacFarlane, 56, of Del Mar, Calif., to plead guilty to conspiracy to commit mail fraud.	Retweet			0.0	1.0	0.0	0.0	0.0	0.0	0.0	0.0	0.0	0.0	0.0	0.0	1.0	0.0	0.0	0.0	0.0	4.0	0.0	0.0	0.0	0.0	0.0	0.0	0.0	0.0	0.0	0.0	0.0	0.0	0.0	0.0	0.0	0.0	0.0	0.0	0.0	0.0	0.0	0.0	0.0	0.0	0.0	0.0	0.0	0.0	0.0	0.0	1.0	0.0	0.0	0.0	2.0	1.0	0.0	0.0	0.0	0.0	0.0	0.0	1.0	0.0	0.0	0.0	0.0	0.0	0.0	0.0	0.0	0.0	0.0	0.0	0.0	0.0	0.0	0.0	0.0	0.0	0.0	0.0	0.0	0.0	2.0	0.0	0.0	0.0	0.0	0.0	0.0	0.0	0.0	0.0	0.0	0.0	0.0	0.0	0.0	0.0	1.0	0.0	0.0	0.0	0.0	0.0	0.0	0.0	0.0	0.0	0.0	0.0	0.0	0.0	0.0	0.0	0.0	0.0	0.0	0.0	0.0	0.0	0.0	0.0	0.0	0.0	0.0	0.0	0.0	0.0	0.0	0.0	0.0	0.0	0.0	2.0	0.0	1.0	0.0	0.0	0.0	0.0	0.0	0.0	0.0	0.0	0.0	0.0	0.0	2.0	0.0	1.0	0.0	2.0	0.0	0.0	0.0	0.0	0.0	0.0	0.0	0.0	0.0	0.0	0.0	2.0	0.0	0.0	0.0	0.0	0.0	0.0	0.0	0.0	0.0	2.0	0.0	1.0	0.0	0.0	0.0	1.0	0.0	0.0	0.0	0.0	0.0	0.0	0.0	0.0	0.0	0.0	0.0	0.0	0.0	0.0
1120705876262678528		http://twitter.com/jecpond/status/1120705876262678528	b'rt @thebreakernews in #operationvarsityblues, ex-usc assistant soccer coach laura janke, 36, of north hollywood, to plead guilty to conspiracy to commit racketeering. ex-title insurance exec toby macfarlane, 56, of del mar, calif., to plead guilty to conspiracy to commit mail fraud.'	@jecpond	j.ponder	Canada	British Columbia	Vancouver	Negative	Neutral	Twitter						RT @theBreakerNews In #OperationVarsityBlues, ex-USC assistant soccer coach Laura Janke, 36, of North Hollywood, to plead guilty to conspiracy to commit racketeering. Ex-title insurance exec Toby MacFarlane, 56, of Del Mar, Calif., to plead guilty to conspiracy to commit mail fraud.	Retweet			0.0	1.0	0.0	0.0	0.0	0.0	0.0	0.0	0.0	0.0	0.0	0.0	1.0	0.0	0.0	0.0	0.0	4.0	0.0	0.0	0.0	0.0	0.0	0.0	0.0	0.0	0.0	0.0	0.0	0.0	0.0	0.0	0.0	0.0	0.0	0.0	0.0	0.0	0.0	0.0	0.0	0.0	0.0	0.0	0.0	0.0	0.0	0.0	1.0	0.0	0.0	0.0	2.0	1.0	0.0	0.0	0.0	0.0	0.0	0.0	1.0	0.0	0.0	0.0	0.0	0.0	0.0	0.0	0.0	0.0	0.0	0.0	0.0	0.0	0.0	0.0	0.0	0.0	0.0	0.0	0.0	0.0	2.0	0.0	0.0	0.0	0.0	0.0	0.0	0.0	0.0	0.0	0.0	0.0	0.0	0.0	0.0	0.0	1.0	0.0	0.0	0.0	0.0	0.0	0.0	0.0	0.0	0.0	0.0	0.0	0.0	0.0	0.0	0.0	0.0	0.0	0.0	0.0	0.0	0.0	0.0	0.0	0.0	0.0	0.0	0.0	0.0	0.0	0.0	0.0	0.0	0.0	0.0	2.0	0.0	1.0	0.0	0.0	0.0	0.0	0.0	0.0	0.0	0.0	0.0	0.0	0.0	2.0	0.0	1.0	0.0	2.0	0.0	0.0	0.0	0.0	0.0	0.0	0.0	0.0	0.0	0.0	0.0	2.0	0.0	0.0	0.0	0.0	0.0	0.0	0.0	0.0	0.0	2.0	0.0	1.0	0.0	0.0	0.0	1.0	0.0	0.0	0.0	0.0	0.0	0.0	0.0	0.0	0.0	0.0	0.0	0.0	0.0	0.0
1120790816618885121		http://twitter.com/EzraNBC/status/1120790816618885121	b'latest development: usc soccer coach, another parent to plead guilty in college admissions scandal. prosecutors recommend over a year in prison for each.   #operationvarsityblues'	@EzraNBC	Ezra Kaplan	United States of America	Massachusetts	Boston	Neutral	Unclassified	Twitter	M					Latest development: USC soccer coach, another parent to plead guilty in college admissions scandal. Prosecutors recommend over a year in prison for each. https://t.co/JkhVXjDIC3 #OperationVarsityBlues	Tweet			0.0	0.0	0.0	0.0	0.0	1.0	0.0	0.0	0.0	0.0	0.0	0.0	0.0	0.0	0.0	1.0	0.0	1.0	0.0	0.0	1.0	0.0	0.0	0.0	0.0	0.0	0.0	0.0	0.0	0.0	0.0	0.0	0.0	0.0	0.0	1.0	0.0	0.0	0.0	0.0	0.0	0.0	0.0	0.0	0.0	0.0	0.0	0.0	1.0	0.0	1.0	0.0	1.0	0.0	1.0	0.0	0.0	0.0	0.0	0.0	0.0	0.0	0.0	0.0	0.0	0.0	0.0	0.0	0.0	0.0	0.0	0.0	0.0	0.0	0.0	0.0	0.0	0.0	0.0	0.0	0.0	0.0	1.0	0.0	0.0	0.0	0.0	0.0	0.0	0.0	0.0	0.0	0.0	0.0	0.0	0.0	0.0	0.0	0.0	0.0	0.0	0.0	0.0	0.0	0.0	0.0	0.0	0.0	0.0	0.0	0.0	0.0	0.0	0.0	0.0	0.0	0.0	0.0	0.0	0.0	0.0	0.0	0.0	0.0	0.0	0.0	0.0	0.0	0.0	0.0	0.0	0.0	0.0	0.0	0.0	0.0	0.0	1.0	0.0	0.0	0.0	0.0	0.0	0.0	0.0	0.0	0.0	1.0	0.0	0.0	0.0	0.0	0.0	0.0	0.0	0.0	0.0	0.0	0.0	0.0	0.0	0.0	0.0	0.0	0.0	0.0	0.0	0.0	0.0	0.0	0.0	0.0	0.0	1.0	0.0	0.0	0.0	0.0	0.0	0.0	0.0	0.0	0.0	0.0	0.0	1.0	0.0	0.0	0.0	0.0	0.0	0.0	0.0	0.0
1120755319322415105		http://twitter.com/LightfootLaw/status/1120755319322415105	b'have you read the latest lightfoots take on the #operationvarsityblues college admissions scandal? check out insights and takeaways from our #ncaa compliance and investigations group:   #ncaacompliance'	@LightfootLaw	Lightfoot, Franklin & White	United Kingdom	West Midlands	Birmingham	Neutral	Neutral	Twitter	M					Have you read the latest “Lightfoot’s Take” on the #OperationVarsityBlues college admissions scandal? Check out insights and takeaways from our #NCAA Compliance and Investigations group: https://t.co/pqghUrhytD #NCAACompliance https://t.co/ih3fh9pPhd	Tweet			0.0	0.0	0.0	0.0	0.0	0.0	0.0	0.0	0.0	0.0	0.0	0.0	0.0	0.0	0.0	0.0	0.0	0.0	0.0	0.0	0.0	0.0	0.0	0.0	0.0	0.0	0.0	0.0	0.0	0.0	0.0	0.0	0.0	0.0	0.0	1.0	0.0	0.0	0.0	0.0	0.0	0.0	0.0	0.0	0.0	0.0	0.0	0.0	0.0	0.0	1.0	0.0	0.0	0.0	0.0	0.0	0.0	0.0	0.0	0.0	0.0	0.0	0.0	0.0	0.0	0.0	0.0	0.0	0.0	0.0	1.0	0.0	0.0	0.0	0.0	0.0	0.0	0.0	0.0	0.0	0.0	0.0	0.0	0.0	0.0	0.0	0.0	0.0	0.0	0.0	0.0	0.0	0.0	0.0	0.0	0.0	0.0	0.0	1.0	0.0	0.0	0.0	0.0	0.0	0.0	0.0	0.0	0.0	0.0	0.0	0.0	0.0	0.0	0.0	0.0	0.0	0.0	0.0	0.0	0.0	0.0	0.0	0.0	0.0	0.0	0.0	0.0	0.0	0.0	0.0	0.0	0.0	0.0	0.0	0.0	0.0	0.0	0.0	0.0	0.0	0.0	0.0	0.0	0.0	0.0	0.0	0.0	0.0	0.0	0.0	0.0	0.0	0.0	0.0	0.0	0.0	0.0	0.0	0.0	0.0	0.0	0.0	0.0	0.0	0.0	0.0	0.0	0.0	0.0	0.0	0.0	0.0	0.0	0.0	0.0	0.0	0.0	0.0	0.0	0.0	0.0	0.0	0.0	0.0	0.0	0.0	0.0	0.0	0.0	0.0	1.0	0.0	0.0	0.0
1120701789903491072		http://twitter.com/brownsbride10/status/1120701789903491072	b'#operationvarsityblues these people need our prayers right now. regardless of the parents poor decisions, we are all human and yes we make mistakes some bigger than others, however we all must remember never to judge and love one another.'	@brownsbride10	Michelle Brown (WardZ)	United States of America	Virginia		Negative	Joy	Twitter	F					#operationvarsityblues These people need our prayers right now. Regardless of the parents poor decisions, We’re all human and yes we make mistakes some bigger than others, however we all must remember never to judge and love one another.	Tweet			0.0	0.0	0.0	0.0	0.0	0.0	0.0	0.0	0.0	0.0	0.0	0.0	0.0	0.0	0.0	1.0	0.0	0.0	0.0	0.0	0.0	0.0	0.0	0.0	0.0	0.0	0.0	0.0	0.0	0.0	0.0	0.0	0.0	0.0	0.0	0.0	0.0	0.0	0.0	0.0	0.0	0.0	0.0	0.0	0.0	0.0	0.0	0.0	0.0	0.0	0.0	1.0	0.0	0.0	0.0	0.0	0.0	0.0	0.0	0.0	1.0	0.0	0.0	0.0	0.0	0.0	0.0	0.0	0.0	0.0	0.0	0.0	0.0	0.0	0.0	0.0	0.0	0.0	0.0	0.0	0.0	0.0	0.0	0.0	0.0	0.0	0.0	0.0	0.0	0.0	0.0	0.0	0.0	0.0	0.0	0.0	1.0	0.0	0.0	0.0	0.0	0.0	0.0	0.0	0.0	0.0	0.0	0.0	0.0	0.0	0.0	0.0	0.0	0.0	0.0	0.0	0.0	0.0	0.0	0.0	0.0	0.0	0.0	0.0	0.0	0.0	0.0	0.0	0.0	0.0	0.0	0.0	0.0	0.0	0.0	0.0	0.0	0.0	0.0	0.0	0.0	0.0	1.0	0.0	0.0	0.0	0.0	0.0	0.0	0.0	0.0	0.0	0.0	0.0	0.0	0.0	0.0	0.0	0.0	0.0	0.0	1.0	0.0	0.0	0.0	0.0	1.0	0.0	0.0	0.0	0.0	0.0	0.0	0.0	0.0	0.0	0.0	0.0	1.0	0.0	0.0	0.0	0.0	0.0	0.0	0.0	0.0	0.0	1.0	0.0	0.0	0.0	1.0	0.0
1120771156301074432		http://twitter.com/keithmestrada/status/1120771156301074432	b'is this lori loughlin raising funds for her defense? for sale: usc mom crewneck sweater. no longer needed. @loriloughlin #auntbecky #operationvarsityblues #usctrojans #fighton https://'	0.0	0.0	0.0	0.0	0.0	1.0	0.0	0.0	0.0	0.0	0.0	0.0	0.0	0.0	0.0	1.0	0.0	0.0	0.0	0.0	0.0	0.0	0.0	0.0	0.0	0.0	0.0	0.0	0.0	0.0	0.0	0.0	0.0	0.0	0.0	0.0	0.0	0.0	0.0	0.0	0.0	0.0	0.0	0.0	0.0	0.0	0.0	0.0	0.0	0.0	0.0	0.0	0.0	0.0	1.0	0.0	0.0	0.0	0.0	0.0	0.0	0.0	0.0	0.0	0.0	0.0	0.0	0.0	0.0	0.0	0.0	0.0	0.0	0.0	0.0	0.0	0.0	0.0	0.0	0.0	0.0	0.0	0.0	0.0	0.0	0.0	0.0	0.0	0.0	0.0	0.0	0.0	0.0	0.0	0.0	0.0	0.0	0.0	0.0	0.0	0.0	0.0	0.0	0.0	0.0	0.0	0.0	0.0	0.0	0.0	0.0	0.0	0.0	0.0	0.0	0.0	0.0	0.0	0.0	0.0	0.0	0.0	0.0	0.0	0.0	0.0	0.0	0.0	0.0	0.0	0.0	0.0	0.0	0.0	0.0	0.0	0.0	0.0	0.0	0.0	0.0	0.0	0.0	0.0	0.0	0.0	0.0	0.0	0.0	0.0	0.0	0.0	0.0	0.0	0.0	0.0	0.0	0.0	0.0	0.0	0.0	0.0	0.0	0.0	0.0	0.0	0.0	0.0	0.0	0.0	0.0	0.0	0.0	0.0	0.0	0.0	0.0	0.0	0.0	0.0	0.0	0.0	0.0	0.0	0.0	1.0	0.0	0.0	0.0	0.0	0.0	0.0	0.0	0.0
