GUID	Date (GMT)	URL	Contents	Author	Name	Country	State/Region	City/Urban Area	Category	Emotion	Source	Gender	Posts	Followers	Following	Post Title	Post Type	Image URL	Brand
1109863692160495616	2019-03-24 17:04:59	http://twitter.com/valerieachao/status/1109863692160495616	@USC Counselors and coaches know when the HS grades are sub par and a student gets into an elite college.	@valerieachao	Valerie Chao	United States of America	California		Neutral	Unclassified	Twitter	F	11	6	26	@USC Counselors and coaches know when the HS grades are sub par and a student gets into an elite college.	Reply		
1109863401184886785	2019-03-24 17:03:49	http://twitter.com/valerieachao/status/1109863401184886785	@USC Some HS counselors and coaches might have also been on the take. Why aren’t we hearing shock and outrage from them ?	@valerieachao	Valerie Chao	United States of America	California		Negative	Unclassified	Twitter	F	10	6	26	"@USC Some HS counselors and coaches might have also been on the take.
Why aren’t we hearing shock and outrage from them ?"	Reply		
1109644393844224000	2019-03-24 02:33:34	http://twitter.com/nancyhurcrabbe/status/1109644393844224000	@USC What about students that already graduated? They should get their degree revoked. If someone gets caught stealing money they don’t get to keep it....	@nancyhurcrabbe	nancy hur-crabbe	United States of America	California		Negative	Anger	Twitter	F	1693	537	592	@USC What about students that already graduated? They should get their degree revoked. If someone gets caught stealing money they don’t get to keep it....	Reply		
1109949429832794112	2019-03-24 22:45:40	http://twitter.com/eman8631/status/1109949429832794112	@USC Wow sounds like good school. If only I had $70 million to donate in order to attend 🙄	@eman8631	eman863				Positive	Sadness	Twitter		463	2	20	@USC Wow sounds like good school. If only I had $70 million to donate in order to attend 🙄	Reply		
1109730753271812097	2019-03-24 08:16:44	http://twitter.com/TheDebateHitman/status/1109730753271812097	@USC @drdre @USCIovineYoung She “got accepted into USC all on her own.” https://t.co/pzOqVAI6HV	@TheDebateHitman	Israel Jacob Ⓥ				Neutral	Joy	Twitter	M	2410	56	108	"@USC @drdre @USCIovineYoung She “got accepted into USC all on her own.”

https://t.co/pzOqVAI6HV"	Reply		
1109945652165992456	2019-03-24 22:30:39	http://twitter.com/VictoryWolfPro1/status/1109945652165992456	RT @USC The unanimous choice of USC's Presidential Search Advisory Committee, President Folt will take office as USC's new president on July 1, 2019. Learn more about her in the USC News story: https://t.co/Ys99lcMq3P	@VictoryWolfPro1	Victory Wolf Productions	United States of America	New York	New York	Neutral	Neutral	Twitter		16	11	24	RT @USC The unanimous choice of USC's Presidential Search Advisory Committee, President Folt will take office as USC's new president on July 1, 2019. Learn more about her in the USC News story: https://t.co/Ys99lcMq3P	Retweet		
