GUID	Date (GMT)	URL	Contents	Author	Name	Country	State/Region	City/Urban Area	Category	Emotion	Source	Gender	Posts	Followers	Following	Post Title	Post Type	Image URL	Brand
1104141843627995138	2019-03-08 22:08:24	http://twitter.com/NU_SoC/status/1104141843627995138	"b'rt @northwesternu during wwii, 200,000 young women and girls were forced into sexual slavery by the japanese military. prof. @elizabethwson amplifies the voices of these ""comfort women,"" as they continue to demand justice and fight for their story to be told. #iwd2019'"	@NU_SoC	NU School of Comm	United States of America	Illinois	Chicago	Neutral	Disgust	Twitter		4342	2527	256	"RT @NorthwesternU During WWII, 200,000 young women and girls were forced into sexual slavery by the Japanese military. Prof. @ElizabethWSon amplifies the voices of these ""comfort women,"" as they continue to demand justice and fight for their story to be told. #IWD2019 https://t.co/feg8g3G8vl https://t.co/fTgh8ZS6Lp"	Retweet		
1103844725541429248	2019-03-08 02:27:45	http://twitter.com/DrHemmings228/status/1103844725541429248	b'rt @northwesternu research from dean @teresakwoodruff and @kelloggschool prof. @uzzileadership shows first-time women principal investigator scientists received considerably less funding from the nih compared to first-time male pis.'	@DrHemmings228	Hemmings	United States of America			Neutral	Neutral	Twitter		17181	49	236	RT @NorthwesternU Research from Dean @teresakwoodruff and @KelloggSchool prof. @UzziLeadership shows first-time women principal investigator scientists received considerably less funding from the NIH compared to first-time male PIs. https://t.co/F6CVfcs18k https://t.co/2U0oNgbxfu	Retweet		
1104157777222647809	2019-03-08 23:11:43	http://twitter.com/kaplanikids/status/1104157777222647809	b'rt @northwesternu from leadership and organization to relationships and family, five northwestern women from diverse backgrounds share their insights on how to #balanceforbetter. #iwd2019'	@kaplanikids	Jenna ConstantinePhD	United States of America	New York	New York	Neutral	Joy	Twitter	F	156490	4779	4001	RT @NorthwesternU From leadership and organization to relationships and family, five Northwestern women from diverse backgrounds share their insights on how to #BalanceForBetter. #IWD2019 https://t.co/8vYECkFRFY	Retweet		
1103984656314191872	2019-03-08 11:43:47	http://twitter.com/danaonani/status/1103984656314191872	b'rt @northwesternu research from dean @teresakwoodruff and @kelloggschool prof. @uzzileadership shows first-time women principal investigator scientists received considerably less funding from the nih compared to first-time male pis.'	@danaonani	Dana Kimelman	Uruguay	Montevideo	Montevideo	Neutral	Neutral	Twitter	F	192	35	253	RT @NorthwesternU Research from Dean @teresakwoodruff and @KelloggSchool prof. @UzziLeadership shows first-time women principal investigator scientists received considerably less funding from the NIH compared to first-time male PIs. https://t.co/F6CVfcs18k https://t.co/2U0oNgbxfu	Retweet		
1104140927185154048	2019-03-08 22:04:45	http://twitter.com/NUPostdocs/status/1104140927185154048	b'rt @northwesternu research from dean @teresakwoodruff and @kelloggschool prof. @uzzileadership shows first-time women principal investigator scientists received considerably less funding from the nih compared to first-time male pis.'	@NUPostdocs	NU Postdocs	United States of America	Illinois	Chicago	Neutral	Neutral	Twitter		92	106	253	RT @NorthwesternU Research from Dean @teresakwoodruff and @KelloggSchool prof. @UzziLeadership shows first-time women principal investigator scientists received considerably less funding from the NIH compared to first-time male PIs. https://t.co/F6CVfcs18k https://t.co/2U0oNgbxfu	Retweet		
1104134995050934274	2019-03-08 21:41:11	http://twitter.com/chattdebdeep/status/1104134995050934274	b'rt @northwesternu research from dean @teresakwoodruff and @kelloggschool prof. @uzzileadership shows first-time women principal investigator scientists received considerably less funding from the nih compared to first-time male pis.'	@chattdebdeep	debdeep chatterjee	Canada	Québec	Montréal	Neutral	Neutral	Twitter		224	110	165	RT @NorthwesternU Research from Dean @teresakwoodruff and @KelloggSchool prof. @UzziLeadership shows first-time women principal investigator scientists received considerably less funding from the NIH compared to first-time male PIs. https://t.co/F6CVfcs18k https://t.co/2U0oNgbxfu	Retweet		
1104099271178096645	2019-03-08 19:19:14	http://twitter.com/MartinIWilson/status/1104099271178096645	"b'rt @northwesternu during wwii, 200,000 young women and girls were forced into sexual slavery by the japanese military. prof. @elizabethwson amplifies the voices of these ""comfort women,"" as they continue to demand justice and fight for their story to be told. #iwd2019'"	@MartinIWilson	Martin Wilson	United States of America	Illinois	Chicago	Neutral	Disgust	Twitter	M	4448	680	980	"RT @NorthwesternU During WWII, 200,000 young women and girls were forced into sexual slavery by the Japanese military. Prof. @ElizabethWSon amplifies the voices of these ""comfort women,"" as they continue to demand justice and fight for their story to be told. #IWD2019 https://t.co/feg8g3G8vl https://t.co/fTgh8ZS6Lp"	Retweet		
